{
  "envelope_version": "1.0.0",
  "collection_id": "anvaiops_incidents",
  "freshness": { "as_of": "2026-06-26T12:00:00Z", "source": "compaction", "segment_watermark": 4821 },
  "record_count": 18234,
  "storage_size_bytes": 734003200,
  "index_size_bytes": 58720256,
  "fields": [
    {
      "name": "title",
      "data_type": "String",
      "null_rate": 0.0,
      "distinct_estimate": 18102,
      "distinct_method": "hll",
      "examples": ["Checkout 500s on payment submit", "DB connection pool exhausted"],
      "indexed": true,
      "filterable": true,
      "approximate": true
    },
    {
      "name": "resolution_time_minutes",
      "data_type": "Int64",
      "null_rate": 0.12,
      "distinct_estimate": 1440,
      "distinct_method": "hll",
      "min": 1,
      "max": 10080,
      "quantiles": { "method": "tdigest", "q": { "0.5": 47.0, "0.9": 312.0, "0.99": 2880.0 } },
      "indexed": false,
      "filterable": true,
      "approximate": true
    }
  ],
  "modality": [
    {
      "kind": "document",
      "doc_count": 18234,
      "avg_doc_length": 412.7,
      "unique_terms_estimate": 92013,
      "top_terms": [
        { "term": "timeout", "doc_frequency": 3120, "idf": 1.77 },
        { "term": "payment", "doc_frequency": 2014, "idf": 2.2 }
      ]
    },
    {
      "kind": "vector",
      "dimension": 768,
      "distance_metric": "cosine",
      "spread": 0.41,
      "cluster_occupancy": [5120, 4310, 3980, 4824],
      "approximate": true
    },
    {
      "kind": "graph",
      "total_nodes": 18234,
      "total_edges": 53120,
      "average_degree": 5.83,
      "max_degree": 412,
      "connected_components": 37,
      "label_counts": [
        { "label": "incident", "count": 18234 },
        { "label": "service", "count": 214 }
      ],
      "edge_type_counts": [
        { "edge_type": "affects", "count": 41020 },
        { "edge_type": "caused_by", "count": 12100 }
      ]
    }
  ]
}
